{"schema_version":"oaw.profile-recipe/v3","taxonomy_version":"oaw.lifecycle-taxonomy/v1","recipe_version":"3.0.0","id":"oaw/domain-engineering","display_name":"Matt Domain Engineering","family":"matt","slots":[{"slot_id":"problem-framing","applicability":"mandatory","outcome_owner":{"kind":"provider-binding","step_id":"matt-framing"},"pipeline":[{"id":"matt-framing","binding_selector":{"provider_id":"oaw/matt","binding_id":"codex-grill-with-docs"},"stage_span":["problem-framing"],"required_input_artifact":"oaw.workflow-artifact/v1","produced_output_artifact":"oaw.workflow-artifact/v1"}],"gates":[{"id":"shared-understanding","authority":"user","predicate":"shared-understanding","evidence_requirements":[{"kind":"shared-understanding-evidence","minimum":1,"description":"One digest-pinned evidence reference is required."}]}],"transitions":[{"signal":"succeeded","target":"solution-specification"}]},{"slot_id":"solution-specification","applicability":"mandatory","outcome_owner":{"kind":"provider-binding","step_id":"matt-spec"},"pipeline":[{"id":"matt-spec","binding_selector":{"provider_id":"oaw/matt","binding_id":"codex-to-spec"},"stage_span":["solution-specification"],"required_input_artifact":"oaw.workflow-artifact/v1","produced_output_artifact":"oaw.workflow-artifact/v1"}],"gates":[{"id":"specification-approved","authority":"user","predicate":"specification-approved","evidence_requirements":[{"kind":"specification-approved-evidence","minimum":1,"description":"One digest-pinned evidence reference is required."}]}],"transitions":[{"signal":"succeeded","target":"delivery-planning"}]},{"slot_id":"delivery-planning","applicability":"mandatory","outcome_owner":{"kind":"provider-binding","step_id":"matt-tickets"},"pipeline":[{"id":"matt-tickets","binding_selector":{"provider_id":"oaw/matt","binding_id":"codex-to-tickets"},"stage_span":["delivery-planning"],"required_input_artifact":"oaw.workflow-artifact/v1","produced_output_artifact":"oaw.workflow-artifact/v1"}],"gates":[{"id":"delivery-plan-approved","authority":"user","predicate":"delivery-plan-approved","evidence_requirements":[{"kind":"delivery-plan-approved-evidence","minimum":1,"description":"One digest-pinned evidence reference is required."}]}],"transitions":[{"signal":"succeeded","target":"workspace-preparation"}]},{"slot_id":"workspace-preparation","applicability":"mandatory","outcome_owner":{"kind":"host-action","host_action":"workspace.prepare-or-confirm"},"pipeline":[],"host_action":{"id":"workspace.prepare-or-confirm","input_artifact":"oaw.workflow-artifact/v1","output_artifact":"oaw.workflow-artifact/v1"},"gates":[{"id":"workspace-ready","authority":"host","predicate":"workspace-ready","evidence_requirements":[{"kind":"workspace-ready-evidence","minimum":1,"description":"One digest-pinned evidence reference is required."}]}],"transitions":[{"signal":"succeeded","target":"implementation"}]},{"slot_id":"implementation","applicability":"mandatory","outcome_owner":{"kind":"provider-binding","step_id":"matt-implement"},"pipeline":[{"id":"matt-implement","binding_selector":{"provider_id":"oaw/matt","binding_id":"codex-implement"},"stage_span":["implementation","implementation-tdd","incident-recovery","review-remediation"],"required_input_artifact":"oaw.workflow-artifact/v1","produced_output_artifact":"oaw.workflow-artifact/v1"}],"gates":[],"transitions":[{"signal":"succeeded","target":"implementation-tdd"}]},{"slot_id":"implementation-tdd","applicability":"mandatory","outcome_owner":{"kind":"provider-binding","step_id":"matt-implement-tdd"},"pipeline":[{"id":"matt-implement-tdd","binding_selector":{"provider_id":"oaw/matt","binding_id":"codex-implement"},"stage_span":["implementation","implementation-tdd","incident-recovery","review-remediation"],"required_input_artifact":"oaw.workflow-artifact/v1","produced_output_artifact":"oaw.workflow-artifact/v1"}],"gates":[],"transitions":[{"signal":"succeeded","target":"review-remediation"}]},{"slot_id":"incident-recovery","applicability":"conditional","outcome_owner":{"kind":"none"},"pipeline":[],"gates":[],"transitions":[]},{"slot_id":"review-remediation","applicability":"mandatory","outcome_owner":{"kind":"provider-binding","step_id":"matt-implement-review"},"pipeline":[{"id":"matt-implement-review","binding_selector":{"provider_id":"oaw/matt","binding_id":"codex-implement"},"stage_span":["implementation","implementation-tdd","incident-recovery","review-remediation"],"required_input_artifact":"oaw.workflow-artifact/v1","produced_output_artifact":"oaw.workflow-artifact/v1"}],"gates":[],"transitions":[{"signal":"succeeded","target":"fresh-verification"}]},{"slot_id":"fresh-verification","applicability":"mandatory","outcome_owner":{"kind":"host-action","host_action":"verification.execute"},"pipeline":[],"host_action":{"id":"verification.execute","input_artifact":"oaw.workflow-artifact/v1","output_artifact":"oaw.workflow-artifact/v1"},"gates":[{"id":"fresh-evidence","authority":"host","predicate":"fresh-evidence","evidence_requirements":[{"kind":"fresh-evidence-evidence","minimum":1,"description":"One digest-pinned evidence reference is required."}]}],"transitions":[{"signal":"succeeded","target":"closeout"}]},{"slot_id":"closeout","applicability":"mandatory","outcome_owner":{"kind":"host-action","host_action":"closeout.execute"},"pipeline":[],"host_action":{"id":"closeout.execute","input_artifact":"oaw.workflow-artifact/v1","output_artifact":"oaw.workflow-artifact/v1"},"gates":[{"id":"user-closeout","authority":"user","predicate":"user-closeout","evidence_requirements":[{"kind":"user-closeout-evidence","minimum":1,"description":"One digest-pinned evidence reference is required."}]}],"transitions":[]}],"add_ons":[],"incident_routes":[{"incident_type":"functional-failure","handler":{"provider_id":"oaw/matt","binding_id":"codex-diagnosing-bugs"},"return_to":"implementation","if_unavailable":"stop"},{"incident_type":"hard-bug","handler":{"provider_id":"oaw/matt","binding_id":"codex-diagnosing-bugs"},"return_to":"implementation","if_unavailable":"stop"},{"incident_type":"performance-regression","handler":{"provider_id":"oaw/matt","binding_id":"codex-diagnosing-bugs"},"return_to":"implementation","if_unavailable":"stop"}],"overlays":[],"stable_boundaries":["specification-approved","ticket-complete","tdd-cycle-complete","debugging-cycle-complete","review-complete","verification-complete"],"environment_requirements":[]}
