{"schema_version":"oaw.profile-recipe/v3","taxonomy_version":"oaw.lifecycle-taxonomy/v1","recipe_version":"3.0.0","id":"oaw/delivery","display_name":"Superpowers Delivery","family":"superpowers","slots":[{"slot_id":"problem-framing","applicability":"mandatory","outcome_owner":{"kind":"provider-binding","step_id":"sp-brainstorm"},"pipeline":[{"id":"sp-brainstorm","binding_selector":{"provider_id":"oaw/superpowers","binding_id":"codex-brainstorming"},"stage_span":["problem-framing","solution-specification","delivery-planning"],"required_input_artifact":"oaw.workflow-artifact/v1","produced_output_artifact":"oaw.workflow-artifact/v1"}],"gates":[{"id":"shared-understanding","authority":"user","predicate":"shared-understanding","evidence_requirements":[{"kind":"shared-understanding-evidence","minimum":1,"description":"One digest-pinned evidence reference is required."}]}],"transitions":[{"signal":"succeeded","target":"solution-specification"}]},{"slot_id":"solution-specification","applicability":"mandatory","outcome_owner":{"kind":"provider-binding","step_id":"sp-design"},"pipeline":[{"id":"sp-design","binding_selector":{"provider_id":"oaw/superpowers","binding_id":"codex-brainstorming"},"stage_span":["problem-framing","solution-specification","delivery-planning"],"required_input_artifact":"oaw.workflow-artifact/v1","produced_output_artifact":"oaw.workflow-artifact/v1"}],"gates":[{"id":"specification-approved","authority":"user","predicate":"specification-approved","evidence_requirements":[{"kind":"specification-approved-evidence","minimum":1,"description":"One digest-pinned evidence reference is required."}]}],"transitions":[{"signal":"succeeded","target":"delivery-planning"}]},{"slot_id":"delivery-planning","applicability":"mandatory","outcome_owner":{"kind":"provider-binding","step_id":"sp-plan"},"pipeline":[{"id":"sp-plan","binding_selector":{"provider_id":"oaw/superpowers","binding_id":"codex-brainstorming"},"stage_span":["problem-framing","solution-specification","delivery-planning"],"required_input_artifact":"oaw.workflow-artifact/v1","produced_output_artifact":"oaw.workflow-artifact/v1"}],"gates":[{"id":"delivery-plan-approved","authority":"user","predicate":"delivery-plan-approved","evidence_requirements":[{"kind":"delivery-plan-approved-evidence","minimum":1,"description":"One digest-pinned evidence reference is required."}]}],"transitions":[{"signal":"succeeded","target":"workspace-preparation"}]},{"slot_id":"workspace-preparation","applicability":"mandatory","outcome_owner":{"kind":"provider-binding","step_id":"sp-inline-workspace"},"pipeline":[{"id":"sp-inline-workspace","binding_selector":{"provider_id":"oaw/superpowers","binding_id":"codex-executing-plans"},"stage_span":["workspace-preparation","implementation","implementation-tdd","incident-recovery","review-remediation","fresh-verification","closeout"],"required_input_artifact":"oaw.workflow-artifact/v1","produced_output_artifact":"oaw.workflow-artifact/v1"}],"gates":[],"transitions":[{"signal":"succeeded","target":"implementation"}]},{"slot_id":"implementation","applicability":"mandatory","outcome_owner":{"kind":"provider-binding","step_id":"sp-inline-implementation"},"pipeline":[{"id":"sp-inline-implementation","binding_selector":{"provider_id":"oaw/superpowers","binding_id":"codex-executing-plans"},"stage_span":["workspace-preparation","implementation","implementation-tdd","incident-recovery","review-remediation","fresh-verification","closeout"],"required_input_artifact":"oaw.workflow-artifact/v1","produced_output_artifact":"oaw.workflow-artifact/v1"}],"gates":[],"transitions":[{"signal":"succeeded","target":"implementation-tdd"}]},{"slot_id":"implementation-tdd","applicability":"mandatory","outcome_owner":{"kind":"provider-binding","step_id":"sp-tdd"},"pipeline":[{"id":"sp-tdd","binding_selector":{"provider_id":"oaw/superpowers","binding_id":"codex-test-driven-development"},"stage_span":["implementation-tdd"],"required_input_artifact":"oaw.workflow-artifact/v1","produced_output_artifact":"oaw.workflow-artifact/v1"}],"gates":[],"transitions":[{"signal":"succeeded","target":"review-remediation"}]},{"slot_id":"incident-recovery","applicability":"conditional","outcome_owner":{"kind":"none"},"pipeline":[],"gates":[],"transitions":[]},{"slot_id":"review-remediation","applicability":"mandatory","outcome_owner":{"kind":"provider-binding","step_id":"sp-request-review"},"pipeline":[{"id":"sp-request-review","binding_selector":{"provider_id":"oaw/superpowers","binding_id":"codex-requesting-code-review"},"stage_span":["review-remediation"],"required_input_artifact":"oaw.workflow-artifact/v1","produced_output_artifact":"oaw.workflow-artifact/v1"},{"id":"sp-receive-review","binding_selector":{"provider_id":"oaw/superpowers","binding_id":"codex-receiving-code-review"},"stage_span":["review-remediation"],"required_input_artifact":"oaw.workflow-artifact/v1","produced_output_artifact":"oaw.workflow-artifact/v1"}],"gates":[],"transitions":[{"signal":"succeeded","target":"fresh-verification"}]},{"slot_id":"fresh-verification","applicability":"mandatory","outcome_owner":{"kind":"provider-binding","step_id":"sp-verification"},"pipeline":[{"id":"sp-verification","binding_selector":{"provider_id":"oaw/superpowers","binding_id":"codex-verification-before-completion"},"stage_span":["fresh-verification"],"required_input_artifact":"oaw.workflow-artifact/v1","produced_output_artifact":"oaw.workflow-artifact/v1"}],"gates":[{"id":"fresh-evidence","authority":"host","predicate":"fresh-evidence","evidence_requirements":[{"kind":"fresh-evidence-evidence","minimum":1,"description":"One digest-pinned evidence reference is required."}]}],"transitions":[{"signal":"succeeded","target":"closeout"}]},{"slot_id":"closeout","applicability":"mandatory","outcome_owner":{"kind":"provider-binding","step_id":"sp-inline-closeout"},"pipeline":[{"id":"sp-inline-closeout","binding_selector":{"provider_id":"oaw/superpowers","binding_id":"codex-executing-plans"},"stage_span":["workspace-preparation","implementation","implementation-tdd","incident-recovery","review-remediation","fresh-verification","closeout"],"required_input_artifact":"oaw.workflow-artifact/v1","produced_output_artifact":"oaw.workflow-artifact/v1"}],"gates":[{"id":"user-closeout","authority":"user","predicate":"user-closeout","evidence_requirements":[{"kind":"user-closeout-evidence","minimum":1,"description":"One digest-pinned evidence reference is required."}]}],"transitions":[]}],"add_ons":[],"incident_routes":[{"incident_type":"build-failure","handler":{"provider_id":"oaw/superpowers","binding_id":"codex-systematic-debugging"},"return_to":"implementation","if_unavailable":"stop"},{"incident_type":"dependency-failure","handler":{"provider_id":"oaw/superpowers","binding_id":"codex-systematic-debugging"},"return_to":"implementation","if_unavailable":"stop"},{"incident_type":"functional-failure","handler":{"provider_id":"oaw/superpowers","binding_id":"codex-systematic-debugging"},"return_to":"implementation","if_unavailable":"stop"},{"incident_type":"type-failure","handler":{"provider_id":"oaw/superpowers","binding_id":"codex-systematic-debugging"},"return_to":"implementation","if_unavailable":"stop"}],"overlays":[],"stable_boundaries":["specification-approved","ticket-complete","tdd-cycle-complete","debugging-cycle-complete","review-complete","verification-complete"],"environment_requirements":[]}
